{
  "patchValidationResultVersion": 1,
  "context": {
    "repositoryContextRef": "repoctx-00112233445566778899aabbccddeeff",
    "inputIdentity": "src/Synthetic/Synthetic.csproj",
    "targetProfile": "profile.external-api"
  },
  "outcome": "accepted",
  "targets": [
    {
      "blockId": "block.widget",
      "symbolRef": {
        "compilationContextRef": "ctx.synthetic.net10",
        "documentationCommentId": "T:Synthetic.Widget"
      },
      "locator": {
        "kind": "repository",
        "path": "src/Synthetic/Widget.cs",
        "originalFileSha256": "91d19144488bb88906a805a24b4b6041638719a2b5d5a623eabff9dcc85b67d3",
        "encoding": "utf-8",
        "declarationSpan": {
          "start": 21,
          "end": 42
        }
      },
      "provenanceRefs": [
        "prov.audit",
        "prov.proposal"
      ],
      "status": "valid"
    }
  ],
  "changedFiles": [
    {
      "path": "src/Synthetic/Widget.cs",
      "originalFileSha256": "91d19144488bb88906a805a24b4b6041638719a2b5d5a623eabff9dcc85b67d3",
      "candidateFileSha256": "1111111111111111111111111111111111111111111111111111111111111111",
      "changedDocumentationBlockCount": 1,
      "originalDocumentationByteCount": 0,
      "candidateDocumentationByteCount": 274,
      "originalDocumentationLineCount": 0,
      "candidateDocumentationLineCount": 13
    }
  ],
  "changedDocumentationBlockCount": 1,
  "invariants": [
    {
      "id": "patch.invariant.non-documentation-tokens-unchanged",
      "status": "passed"
    },
    {
      "id": "patch.invariant.selected-documentation-only",
      "status": "passed"
    },
    {
      "id": "patch.invariant.no-new-parse-diagnostics",
      "status": "passed"
    },
    {
      "id": "patch.invariant.symbol-semantics-unchanged",
      "status": "passed"
    },
    {
      "id": "patch.invariant.repository-scope",
      "status": "passed"
    },
    {
      "id": "patch.invariant.file-representation-preserved",
      "status": "passed"
    },
    {
      "id": "patch.invariant.idempotent",
      "status": "passed"
    },
    {
      "id": "patch.invariant.traceable",
      "status": "passed"
    },
    {
      "id": "patch.invariant.fail-closed",
      "status": "passed"
    }
  ],
  "diagnostics": []
}
